{
  "$schema": "http://json-schema.org/draft-07/schema#",
  "title": "GenrePack",
  "description": "A genre pack: the minimum component set that makes a genre playable, declared as reuse of existing components plus new descriptors introduced by the pack. A pack is a planning and composition contract — it does not claim its members have runtime adapters.",
  "type": "object",
  "required": [
    "id",
    "name",
    "version",
    "loop",
    "views",
    "memberComponents",
    "newComponents",
    "signatureCompound"
  ],
  "properties": {
    "id": {
      "type": "string",
      "pattern": "^genre\\.[a-z0-9_]+$",
      "description": "Genre identifier, e.g. genre.platformer."
    },
    "name": {
      "type": "string"
    },
    "description": {
      "type": "string"
    },
    "version": {
      "type": "string"
    },
    "loop": {
      "type": "string",
      "description": "The minimum repeatable player cycle this pack must support, e.g. 'traverse → jump/avoid → collect → reach goal'."
    },
    "views": {
      "type": "array",
      "minItems": 1,
      "uniqueItems": true,
      "description": "View modes this pack defaults to. The first entry is the primary view.",
      "items": {
        "type": "string",
        "enum": [
          "top-down",
          "side-scroll-2d",
          "voxel",
          "isometric",
          "ui-forward"
        ]
      }
    },
    "memberComponents": {
      "type": "array",
      "description": "Ids of existing catalog components this pack reuses. These are not owned by the pack.",
      "items": {
        "type": "string"
      }
    },
    "newComponents": {
      "type": "array",
      "description": "Ids of new component descriptors introduced by this pack. Each id must have a matching components/<category>/<Name>.component.json descriptor in the same change.",
      "items": {
        "type": "string"
      }
    },
    "signatureCompound": {
      "type": "object",
      "description": "Sketch of the one compound that proves this genre's core loop. A sketch is not a validated compound recipe; promoting it to compounds/ is a separate step.",
      "required": [
        "name",
        "description",
        "memberIds"
      ],
      "additionalProperties": false,
      "properties": {
        "name": {
          "type": "string"
        },
        "description": {
          "type": "string"
        },
        "memberIds": {
          "type": "array",
          "minItems": 2,
          "items": {
            "type": "string"
          }
        }
      }
    },
    "tags": {
      "type": "array",
      "items": {
        "type": "string"
      }
    }
  }
}
