{
  "id": "genre.dungeon_crawler",
  "name": "Dungeon Crawler",
  "description": "Descend a seeded stack of procedural floors where authored rooms, traps, fog, and a boss at the bottom turn 'one more floor' into a session. The app's dd-* TypeScript generators already prove this loop; this pack declares the library-native contract they map onto.",
  "version": "0.1.0",
  "loop": "enter floor → rooms/corridors → traps/treasure/boss → descend",
  "views": [
    "top-down",
    "voxel",
    "isometric"
  ],
  "memberComponents": [
    "movement.pathfinding_system",
    "inventory.loot_table",
    "inventory.affix_loot_generator",
    "world.hazard_volume",
    "world.vision_system",
    "movement.basic_walk",
    "combat.unit_roster",
    "combat.melee_basic",
    "combat.damage_resolver",
    "movement.pursuit_agent",
    "combat.contact_attack",
    "combat.aggro_table",
    "combat.turn_order_queue",
    "combat.action_point_economy",
    "combat.status_effects",
    "utility.behavior_fsm",
    "ui.hud",
    "presentation.style_presets",
    "presentation.camera_follow",
    "presentation.battle_stage",
    "combat.engage_target",
    "ui.event_log",
    "combat.equipment_slots",
    "combat.room_encounters",
    "inventory.ground_items",
    "presentation.hit_feedback",
    "presentation.screen_shake",
    "inventory.potion_belt",
    "progression.xp_leveling",
    "presentation.audio_system",
    "world.dungeon_doors"
  ],
  "newComponents": [
    "world.floor_descent",
    "world.room_template",
    "world.trap_system",
    "world.fog_of_war_reveal",
    "combat.boss_encounter_script"
  ],
  "signatureCompound": {
    "name": "Floor Descent Loop",
    "description": "floor_descent derives the seed and emits the floor, room_template stamps authored rooms into it, fog_of_war_reveal records what the party has seen, trap_system hides the teeth, and boss_encounter_script closes the bottom floor. Descend, repeat, die wiser.",
    "memberIds": [
      "world.floor_descent",
      "world.room_template",
      "world.fog_of_war_reveal",
      "world.trap_system",
      "combat.boss_encounter_script"
    ]
  },
  "tags": [
    "rpg-family",
    "procedural",
    "dungeon"
  ]
}
